{
  "id": "p4-20251215-0001-2",
  "part": 4,
  "level": "B1",
  "topic": [
    "train",
    "timetable change"
  ],
  "assets": {
    "audio_url": "https://raw.githubusercontent.com/ando-244/toeic-gpt-free/main/media/audio/part4/2025/12/p4-20251215-0001.mp3",
    "page_url": "https://ando-244.github.io/toeic-gpt-free/items/part4/2025/12/p4-20251215-0001-2.html"
  },
  "format": {
    "choices": [
      "A",
      "B",
      "C",
      "D"
    ],
    "answer": "A",
    "question_type": "single",
    "toeic_part_rule": "P4-Talk"
  },
  "content": {
    "stem": "(audio) In what way will some trains change?",
    "choices": {
      "A": "They will depart five minutes earlier.",
      "B": "They will stop at fewer stations.",
      "C": "They will be canceled on weekends.",
      "D": "They will become express trains."
    },
    "transcript": [
      {
        "speaker": "N",
        "text": "This is an announcement from the North Line Railway Company. From next Monday, the weekday morning timetable will change on trains heading toward Central Station. Some trains will depart five minutes earlier than before. Please check the new timetable on the platform displays or on our website before you travel. We apologize for any inconvenience this may cause."
      }
    ],
    "rationale": "Some trains depart five minutes earlier."
  },
  "license": {
    "type": "CC-BY-4.0",
    "origin": "original"
  }
}