{
  "id": "p1-20251216-0001",
  "part": 1,
  "level": "B1",
  "topic": [
    "train",
    "interior",
    "passengers"
  ],
  "assets": {
    "audio_url": "https://raw.githubusercontent.com/ando-244/toeic-gpt-free/main/media/audio/part1/2025/12/p1-20251216-0001.mp3",
    "image_url": "https://raw.githubusercontent.com/ando-244/toeic-gpt-free/main/media/images/part1/2025/12/p1-20251216-0001.jpg",
    "page_url": "https://ando-244.github.io/toeic-gpt-free/items/part1/2025/12/p1-20251216-0001.html"
  },
  "format": {
    "choices": [
      "A",
      "B",
      "C",
      "D"
    ],
    "answer": "A",
    "question_type": "single",
    "toeic_part_rule": "P1-Photo"
  },
  "content": {
    "stem": "(photo) Choose the statement that best describes the picture.",
    "choices": {
      "A": "Passengers are sitting with luggage inside a train.",
      "B": "A cook is chopping vegetables in a kitchen.",
      "C": "A scientist is giving a lecture in an auditorium.",
      "D": "A boy is flying a kite in a field."
    },
    "transcript": [
      {
        "speaker": "N",
        "text": "Statement A. Passengers are sitting with luggage inside a train."
      },
      {
        "speaker": "N",
        "text": "Statement B. A cook is chopping vegetables in a kitchen."
      },
      {
        "speaker": "N",
        "text": "Statement C. A scientist is giving a lecture in an auditorium."
      },
      {
        "speaker": "N",
        "text": "Statement D. A boy is flying a kite in a field."
      }
    ],
    "rationale": "Option A correctly describes passengers seated with luggage inside a train carriage. The other options show completely different places such as a kitchen, an auditorium, or a field."
  },
  "license": {
    "type": "CC-BY-4.0",
    "origin": "original"
  }
}