{
  "id": "p4-20251127-0002-1",
  "part": 4,
  "level": "A2",
  "topic": [
    "pool",
    "rules"
  ],
  "assets": {
    "audio_url": "https://raw.githubusercontent.com/ando-244/toeic-gpt-free/main/media/audio/part4/2025/11/p4-20251127-0002.mp3",
    "page_url": "https://ando-244.github.io/toeic-gpt-free/items/part4/2025/11/p4-20251127-0002-1.html"
  },
  "format": {
    "choices": [
      "A",
      "B",
      "C",
      "D"
    ],
    "answer": "B",
    "question_type": "single",
    "toeic_part_rule": "P4-Talk"
  },
  "content": {
    "stem": "(audio) What should visitors do before entering the pool?",
    "choices": {
      "A": "Eat a big meal.",
      "B": "Take a shower and stretch.",
      "C": "Run around the pool.",
      "D": "Turn off the lights."
    },
    "transcript": [
      {
        "speaker": "N",
        "text": "Welcome to the city swimming pool. Before entering the water, please take a shower and do some light stretching. Running around the pool is dangerous, so always walk. Children must stay with an adult at all times."
      }
    ],
    "rationale": "They are told to shower and stretch."
  },
  "license": {
    "type": "CC-BY-4.0",
    "origin": "original"
  }
}