{
  "id": "p3-20251210-0004-2",
  "part": 3,
  "level": "B1",
  "topic": [
    "office",
    "lunch"
  ],
  "assets": {
    "audio_url": "https://raw.githubusercontent.com/ando-244/toeic-gpt-free/main/media/audio/part3/2025/12/p3-20251210-0004.mp3",
    "page_url": "https://ando-244.github.io/toeic-gpt-free/items/part3/2025/12/p3-20251210-0004-2.html"
  },
  "format": {
    "choices": [
      "A",
      "B",
      "C",
      "D"
    ],
    "answer": "C",
    "question_type": "single",
    "toeic_part_rule": "P3-Conversation"
  },
  "content": {
    "stem": "(audio) Where does the woman suggest going?",
    "choices": {
      "A": "The company cafeteria.",
      "B": "A restaurant in the station.",
      "C": "The new cafe across the street.",
      "D": "A convenience store nearby."
    },
    "transcript": [
      {
        "speaker": "W",
        "text": "Do you have plans for lunch today?"
      },
      {
        "speaker": "M",
        "text": "Not really. I was just going to eat at my desk."
      },
      {
        "speaker": "W",
        "text": "Why don’t we try the new cafe across the street?"
      },
      {
        "speaker": "M",
        "text": "Sounds good. Let’s leave at twelve."
      }
    ],
    "rationale": "She suggests the new cafe across the street."
  },
  "license": {
    "type": "CC-BY-4.0",
    "origin": "original"
  }
}