{
  "id": "p3-20251210-0003-1",
  "part": 3,
  "level": "B1",
  "topic": [
    "delivery",
    "redelivery"
  ],
  "assets": {
    "audio_url": "https://raw.githubusercontent.com/ando-244/toeic-gpt-free/main/media/audio/part3/2025/12/p3-20251210-0003.mp3",
    "page_url": "https://ando-244.github.io/toeic-gpt-free/items/part3/2025/12/p3-20251210-0003-1.html"
  },
  "format": {
    "choices": [
      "A",
      "B",
      "C",
      "D"
    ],
    "answer": "C",
    "question_type": "single",
    "toeic_part_rule": "P3-Conversation"
  },
  "content": {
    "stem": "(audio) What happened while the man was out?",
    "choices": {
      "A": "His neighbor visited him.",
      "B": "A package was delivered successfully.",
      "C": "A delivery attempt was made.",
      "D": "The electricity was turned off."
    },
    "transcript": [
      {
        "speaker": "M",
        "text": "I found a notice from the delivery company on my door."
      },
      {
        "speaker": "W",
        "text": "Oh, did they try to deliver a package while you were out?"
      },
      {
        "speaker": "M",
        "text": "Yes, it says they will come again tomorrow afternoon."
      },
      {
        "speaker": "W",
        "text": "You should call them if you need to change the time."
      }
    ],
    "rationale": "The notice shows that the company tried to deliver a package."
  },
  "license": {
    "type": "CC-BY-4.0",
    "origin": "original"
  }
}