{
  "id": "p3-20251210-0002-1",
  "part": 3,
  "level": "B1",
  "topic": [
    "office",
    "meeting room"
  ],
  "assets": {
    "audio_url": "https://raw.githubusercontent.com/ando-244/toeic-gpt-free/main/media/audio/part3/2025/12/p3-20251210-0002.mp3",
    "page_url": "https://ando-244.github.io/toeic-gpt-free/items/part3/2025/12/p3-20251210-0002-1.html"
  },
  "format": {
    "choices": [
      "A",
      "B",
      "C",
      "D"
    ],
    "answer": "C",
    "question_type": "single",
    "toeic_part_rule": "P3-Conversation"
  },
  "content": {
    "stem": "(audio) What does the woman want to know?",
    "choices": {
      "A": "If the meeting room has a projector.",
      "B": "If the meeting room is air-conditioned.",
      "C": "If the meeting room is free at three.",
      "D": "If the meeting room is on the second floor."
    },
    "transcript": [
      {
        "speaker": "W",
        "text": "Is the meeting room free at three this afternoon?"
      },
      {
        "speaker": "M",
        "text": "Let me check the calendar. No, it’s booked until four."
      },
      {
        "speaker": "W",
        "text": "Then we’ll have to start at four thirty."
      },
      {
        "speaker": "M",
        "text": "I’ll update the schedule and inform the team."
      }
    ],
    "rationale": "She asks whether it is free at three."
  },
  "license": {
    "type": "CC-BY-4.0",
    "origin": "original"
  }
}