{
  "id": "p3-20251106-0001-1",
  "part": 3,
  "level": "B1",
  "topic": [
    "office",
    "schedule"
  ],
  "assets": {
    "audio_url": "https://ando-244.github.io/toeic-gpt-free/media/audio/part3/2025/11/p3-0001.mp3"
  },
  "format": {
    "choices": [
      "A",
      "B",
      "C",
      "D"
    ],
    "answer": "B",
    "question_type": "single",
    "toeic_part_rule": "P3-Conversation"
  },
  "content": {
    "stem": "(audio) What are the speakers mainly discussing?",
    "choices": {
      "A": "A change in travel plans.",
      "B": "A change in meeting time.",
      "C": "A new employee policy.",
      "D": "A customer complaint."
    },
    "transcript": [
      {
        "speaker": "M",
        "text": "Good morning. Did you check the new meeting schedule?"
      },
      {
        "speaker": "W",
        "text": "Yes, it starts at ten instead of nine."
      },
      {
        "speaker": "M",
        "text": "Right, and weâ€™ll meet in room B now."
      }
    ],
    "rationale": "They talk about a schedule change, so B is correct."
  },
  "license": {
    "type": "CC-BY-4.0",
    "origin": "original"
  }
}