{
  "id": "p3-20251210-0005-2",
  "part": 3,
  "level": "B1",
  "topic": [
    "restaurant",
    "waiting"
  ],
  "assets": {
    "audio_url": "https://raw.githubusercontent.com/ando-244/toeic-gpt-free/main/media/audio/part3/2025/12/p3-20251210-0005.mp3",
    "page_url": "https://ando-244.github.io/toeic-gpt-free/items/part3/2025/12/p3-20251210-0005-2.html"
  },
  "format": {
    "choices": [
      "A",
      "B",
      "C",
      "D"
    ],
    "answer": "C",
    "question_type": "single",
    "toeic_part_rule": "P3-Conversation"
  },
  "content": {
    "stem": "(audio) How long is the wait for a table?",
    "choices": {
      "A": "Five minutes.",
      "B": "Ten minutes.",
      "C": "Twenty minutes.",
      "D": "One hour."
    },
    "transcript": [
      {
        "speaker": "W",
        "text": "How long is the wait for a table?"
      },
      {
        "speaker": "M",
        "text": "About twenty minutes, but the counter seats are free."
      },
      {
        "speaker": "W",
        "text": "That’s fine. We’ll take the counter seats."
      },
      {
        "speaker": "M",
        "text": "Great. Please follow me."
      }
    ],
    "rationale": "The man says about twenty minutes."
  },
  "license": {
    "type": "CC-BY-4.0",
    "origin": "original"
  }
}