{
  "id": "p1-20251205-0002",
  "part": 1,
  "level": "A2",
  "topic": [
    "cafe",
    "outdoor",
    "tables"
  ],
  "assets": {
    "audio_url": "https://raw.githubusercontent.com/ando-244/toeic-gpt-free/main/media/audio/part1/2025/12/p1-20251205-0002.mp3",
    "image_url": "https://raw.githubusercontent.com/ando-244/toeic-gpt-free/main/media/images/part1/2025/12/p1-20251205-0002.jpg",
    "page_url": "https://ando-244.github.io/toeic-gpt-free/items/part1/2025/12/p1-20251205-0002.html"
  },
  "format": {
    "choices": [
      "A",
      "B",
      "C",
      "D"
    ],
    "answer": "B",
    "question_type": "single",
    "toeic_part_rule": "P1-Photo"
  },
  "content": {
    "stem": "(photo) Choose the statement that best describes the picture.",
    "choices": {
      "A": "A doctor is writing notes on a chart.",
      "B": "People are sitting at small tables outside a café and talking.",
      "C": "A worker is painting lines on a road.",
      "D": "A woman is closing a window in an office."
    },
    "transcript": [
      {
        "speaker": "N",
        "text": "Statement A. A doctor is writing notes on a chart."
      },
      {
        "speaker": "N",
        "text": "Statement B. People are sitting at small tables outside a café and talking."
      },
      {
        "speaker": "N",
        "text": "Statement C. A worker is painting lines on a road."
      },
      {
        "speaker": "N",
        "text": "Statement D. A woman is closing a window in an office."
      }
    ],
    "rationale": "The correct description matches an outdoor café scene. The other options show medical, road, or office settings."
  },
  "license": {
    "type": "CC-BY-4.0",
    "origin": "original"
  }
}