{
  "id": "p4-20251127-0003-1",
  "part": 4,
  "level": "A2",
  "topic": [
    "park",
    "lost item"
  ],
  "assets": {
    "audio_url": "https://raw.githubusercontent.com/ando-244/toeic-gpt-free/main/media/audio/part4/2025/11/p4-20251127-0003.mp3",
    "page_url": "https://ando-244.github.io/toeic-gpt-free/items/part4/2025/11/p4-20251127-0003-1.html"
  },
  "format": {
    "choices": [
      "A",
      "B",
      "C",
      "D"
    ],
    "answer": "B",
    "question_type": "single",
    "toeic_part_rule": "P4-Talk"
  },
  "content": {
    "stem": "(audio) What has been found in the park?",
    "choices": {
      "A": "A pair of glasses.",
      "B": "A blue backpack.",
      "C": "A red umbrella.",
      "D": "A mobile phone."
    },
    "transcript": [
      {
        "speaker": "N",
        "text": "Attention, visitors. A small blue backpack has been found near the playground. If you think it may belong to you or your child, please come to the park office next to the main gate. A staff member will help you there."
      }
    ],
    "rationale": "The announcement mentions a small blue backpack."
  },
  "license": {
    "type": "CC-BY-4.0",
    "origin": "original"
  }
}