{
  "id": "p4-20251106-0001-1",
  "part": 4,
  "level": "B1",
  "topic": [
    "announcement",
    "airport"
  ],
  "assets": {
    "audio_url": "https://ando-244.github.io/toeic-gpt-free/media/audio/part4/2025/11/p4-0001.mp3"
  },
  "format": {
    "choices": [
      "A",
      "B",
      "C",
      "D"
    ],
    "answer": "A",
    "question_type": "single",
    "toeic_part_rule": "P4-Talk"
  },
  "content": {
    "stem": "(audio) What is the announcement mainly about?",
    "choices": {
      "A": "A flight delay notice.",
      "B": "A hotel reservation.",
      "C": "A restaurant promotion.",
      "D": "A safety regulation."
    },
    "transcript": [
      {
        "speaker": "N",
        "text": "Good afternoon, passengers. This is an announcement for all travelers waiting for Flight 102 to Seattle. Due to heavy fog, the departure will be delayed for about thirty minutes. Please remain near Gate 12 and listen for further updates. We apologize for the inconvenience and thank you for your patience."
      }
    ],
    "rationale": "The talk explains a flight delay, so A is correct."
  },
  "license": {
    "type": "CC-BY-4.0",
    "origin": "original"
  }
}