{
  "id": "p1-20251216-0003",
  "part": 1,
  "level": "B1",
  "topic": [
    "railway",
    "station",
    "ticket"
  ],
  "assets": {
    "audio_url": "https://raw.githubusercontent.com/ando-244/toeic-gpt-free/main/media/audio/part1/2025/12/p1-20251216-0003.mp3",
    "image_url": "https://raw.githubusercontent.com/ando-244/toeic-gpt-free/main/media/images/part1/2025/12/p1-20251216-0003.jpg",
    "page_url": "https://ando-244.github.io/toeic-gpt-free/items/part1/2025/12/p1-20251216-0003.html"
  },
  "format": {
    "choices": [
      "A",
      "B",
      "C",
      "D"
    ],
    "answer": "D",
    "question_type": "single",
    "toeic_part_rule": "P1-Photo"
  },
  "content": {
    "stem": "(photo) Choose the statement that best describes the picture.",
    "choices": {
      "A": "A musician is performing in a subway tunnel.",
      "B": "A chef is washing vegetables in a sink.",
      "C": "A nurse is arranging medicine on a cart.",
      "D": "People are standing in front of ticket machines at a station."
    },
    "transcript": [
      {
        "speaker": "N",
        "text": "Statement A. A musician is performing in a subway tunnel."
      },
      {
        "speaker": "N",
        "text": "Statement B. A chef is washing vegetables in a sink."
      },
      {
        "speaker": "N",
        "text": "Statement C. A nurse is arranging medicine on a cart."
      },
      {
        "speaker": "N",
        "text": "Statement D. People are standing in front of ticket machines at a station."
      }
    ],
    "rationale": "Option D correctly shows travelers standing in front of ticket machines at a railway station. The other options describe unrelated jobs and locations."
  },
  "license": {
    "type": "CC-BY-4.0",
    "origin": "original"
  }
}