{
  "id": "p3-20251210-0001-2",
  "part": 3,
  "level": "B1",
  "topic": [
    "office",
    "phone"
  ],
  "assets": {
    "audio_url": "https://raw.githubusercontent.com/ando-244/toeic-gpt-free/main/media/audio/part3/2025/12/p3-20251210-0001.mp3",
    "page_url": "https://ando-244.github.io/toeic-gpt-free/items/part3/2025/12/p3-20251210-0001-2.html"
  },
  "format": {
    "choices": [
      "A",
      "B",
      "C",
      "D"
    ],
    "answer": "B",
    "question_type": "single",
    "toeic_part_rule": "P3-Conversation"
  },
  "content": {
    "stem": "(audio) What does the man ask the woman to do?",
    "choices": {
      "A": "Take a message.",
      "B": "Transfer the call.",
      "C": "Call the client back.",
      "D": "Cancel the meeting."
    },
    "transcript": [
      {
        "speaker": "W",
        "text": "Mr. Kimura, you have a call from a client."
      },
      {
        "speaker": "M",
        "text": "Could you ask her to hold for a minute?"
      },
      {
        "speaker": "W",
        "text": "Sure. Should I transfer the call to your desk?"
      },
      {
        "speaker": "M",
        "text": "Yes, please. I’ll be ready in a moment."
      }
    ],
    "rationale": "He wants her to transfer the call to his desk."
  },
  "license": {
    "type": "CC-BY-4.0",
    "origin": "original"
  }
}