{
  "id": "p1-20251205-0005",
  "part": 1,
  "level": "A2",
  "topic": [
    "woman",
    "refilling",
    "bird"
  ],
  "assets": {
    "audio_url": "https://raw.githubusercontent.com/ando-244/toeic-gpt-free/main/media/audio/part1/2025/12/p1-20251205-0005.mp3",
    "image_url": "https://raw.githubusercontent.com/ando-244/toeic-gpt-free/main/media/images/part1/2025/12/p1-20251205-0005.jpg",
    "page_url": "https://ando-244.github.io/toeic-gpt-free/items/part1/2025/12/p1-20251205-0005.html"
  },
  "format": {
    "choices": [
      "A",
      "B",
      "C",
      "D"
    ],
    "answer": "A",
    "question_type": "single",
    "toeic_part_rule": "P1-Photo"
  },
  "content": {
    "stem": "(photo) Choose the statement that best describes the picture.",
    "choices": {
      "A": "The woman is refilling a bird feeder.",
      "B": "She is skiing through snow.",
      "C": "She is playing drums in a band.",
      "D": "She is washing her car at a gas station."
    },
    "transcript": [
      {
        "speaker": "N",
        "text": "Statement A. The woman is refilling a bird feeder."
      },
      {
        "speaker": "N",
        "text": "Statement B. She is skiing through snow."
      },
      {
        "speaker": "N",
        "text": "Statement C. She is playing drums in a band."
      },
      {
        "speaker": "N",
        "text": "Statement D. She is washing her car at a gas station."
      }
    ],
    "rationale": "The woman is adding food to a bird feeder outside."
  },
  "license": {
    "type": "CC-BY-4.0",
    "origin": "original"
  }
}